{
  "handoff_id": "DRH-004",
  "component_ref": "ent_tb3_04",
  "reason_for_handoff": "cross_jurisdiction_divergence",
  "d_class_hs_position": "US 3921.19.0000 stable/high; EU 8507.90.31 stable/high; India 3921.19.90 stable/medium. Divergence is explicit and preserved.",
  "aa_classification_candidate": {
    "component": "Separator (PE/PP Film)",
    "entity_id": "ent_tb3_04",
    "gri_path": "GRI_1",
    "jurisdiction_divergence": true,
    "divergence_type": "heading_level",
    "divergence_note": "US/India classify as Chapter 39 cellular plastics; EU classifies as Chapter 85 battery separator under a binding carve-out for <40μm films.",
    "stability_us": "stable",
    "stability_eu": "stable",
    "stability_india": "stable",
    "confidence_us": "high",
    "confidence_eu": "high",
    "confidence_india": "medium",
    "hs_code_us": "3921.19.0000",
    "hs_code_eu": "8507.90.31",
    "hs_code_india": "3921.19.90"
  },
  "ruling_records_involved": [
    "CBP HQ 967313",
    "EU Commission Note C/2025/6096",
    "EU CN Regulation 2025/1926"
  ],
  "contradiction_record": null,
  "open_question_for_d_ruling": "Should this separator divergence remain a permanent jurisdiction-specific split, or is there later India-side or international authority strong enough to justify moving India off the current Chapter 39 route or reframing the divergence for downstream legal guidance?",
  "founder_override_provenance": true,
  "founder_override_scope": "missing_primary_text_india_case_law",
  "founder_override_basis": "ey_pwc_secondary_authority",
  "founder_override_note": "Founder-approved temporary provenance bridge for missing Indian primary case texts discussing separator treatment. EY and PwC secondary summaries are accepted for the test run only and must be replaced when the underlying India judgments/orders are acquired.",
  "primary_text_status": "not_yet_acquired",
  "secondary_authority_sources": [
    {
      "source": "PwC Customs & Trade Newsletter / Case law collation",
      "citation": "Exide Industries Ltd. v. Commissioner of Customs (2007)",
      "forum": "CESTAT",
      "date": "2007",
      "holding_summary": "Battery separators in roll form treated as parts of accumulators rather than plastic articles, providing secondary support for a competing Chapter 85 route.",
      "source_type": "secondary",
      "source_publisher": "PwC",
      "primary_text_status": "not_yet_acquired"
    },
    {
      "source": "PwC Customs & Trade Newsletter / Case law collation",
      "citation": "HBL Nife Power Systems Ltd. v. Commissioner of Customs (2012)",
      "forum": "CESTAT (Bangalore)",
      "date": "2012",
      "holding_summary": "Followed Exide and treated battery separators as accumulator parts, reinforcing the existence of a live India-side Chapter 85 counter-signal.",
      "source_type": "secondary",
      "source_publisher": "PwC",
      "primary_text_status": "not_yet_acquired"
    }
  ],
  "override_applies_to_jurisdictions": ["IN"],
  "override_review_required_when_primary_acquired": true,
  "jurisdiction_divergence_detail": {
    "jurisdiction_a": "US/India",
    "code_a": "3921.19.0000 (US); 3921.19.90 (India)",
    "ruling_a": "CBP HQ 967313; India material-first Chapter 39 route",
    "jurisdiction_b": "EU",
    "code_b": "8507.90.31",
    "ruling_b": "EU Commission Note C/2025/6096 + EU CN Regulation 2025/1926"
  },
  "created_at": "2026-04-09T09:22:00Z"
}
